,sentences,understand?(Y/N),understand before experiment?(Y/N)
0,"If a proposal by the Australian government goes ahead, the region will also become the world's largest marine protected area, with restrictions or bans on fishing, mining and marine farming",,
1,We all tend to subconsciously copy gestures of people we like,,
2,"Robots are currently under a two-year trial in Wales which will train ""farmbots"" to herd, monitor the health of livestock, and make sure there is enough pasture for them to graze on",,
3,"The efforts of millions of drivers to get ahead do not miraculously produce a situation in which everyone does better than before, but one in which almost everyone does rather worse",,
4,"This way new idols have been brought to the stage: politicians, celebrities, and other big names",,
